id,name_vi,region,category,meal_types,prep_time_min,cook_time_min,difficulty,calories,protein_g,carbs_g,fat_g,fiber_g,sodium_mg,sugar_g,price_est_vnd_min,price_est_vnd_max,diet_tags,allergens,taste_profile,spice_level,servings,image_url,description,ingredients,utensils,steps,suitable_for,avoid_for
salad-dau-hu-rau-cu-tong-hop-sot-sua-chua,Salad Đậu hũ rau củ tổng hợp sốt sữa chua,Trung,snack,lunch,20,20,medium,496,30,52,8,9,415,4,25000,65000,eatclean,soy,"light,savory",0,1,https://cdn.tgdd.vn/2020/10/CookRecipe/Avatar/salad-dau-hu-rau-cu-thumbnail.jpg,"Salad Đậu hũ rau củ tổng hợp sốt sữa chua là món ăn Eat Clean kiểu Việt, đủ đạm - tinh bột tốt - rau xanh, thích hợp cho người kiểm soát cân nặng.","Đậu hũ: 120g, yến mạch cán dẹt: 100g, rau củ tổng hợp: 100g, Dầu ôliu: 10ml, Nước mắm nhạt/ muối: 3g, Tiêu: 2g, Hành tỏi băm: 10g","Nồi hấp, Rây, Thau, Đũa, Vá","Cắt đậu hũ thành miếng vừa ăn, trộn đều với dầu ô liu, một ít muối và tiêu, Nướng hoặc áp chảo đậu hũ trong 15-20 phút đến khi vàng giòn, Trộn yến mạch cán dẹt với chút dầu ô liu và nướng ở 180°C trong 5-7 phút cho giòn, Chuẩn bị sốt bằng cách trộn đều sữa chua không đường với nước mắm nhạt, tỏi băm và một ít tiêu, Xếp các loại rau củ tươi (như xà lách, cà chua bi, dưa leo) ra đĩa, Rắc đậu hũ và yến mạch đã nướng giòn lên trên, Rưới đều sốt sữa chua lên salad ngay trước khi dùng để giữ độ giòn.","Sinh viên, Người giảm cân","Người cần ăn nhiều năng lượng, Người dị ứng thành phần"
salad-ca-basa-rau-cu-tong-hop-sot-sua-chua,Salad Cá basa rau củ tổng hợp sốt sữa chua,Bắc,snack,lunch,15,10,medium,400,21,44,14,5,392,5,40000,60000,eatclean,fish_sauce,"light,savory",1,1,https://img-global.cpcdn.com/steps/c5298f2be7fc769f/640x640sq80/photo.webp,"Salad Cá basa rau củ tổng hợp sốt sữa chua là món ăn Eat Clean kiểu Việt, đủ đạm - tinh bột tốt - rau xanh, thích hợp cho người kiểm soát cân nặng.","Cá basa: 120g, miến dong: 100g, rau củ tổng hợp: 100g, Dầu ôliu: 10ml, Nước mắm nhạt/ muối: 3g, Tiêu: 2g, Hành tỏi băm: 10g","Nồi hấp, Rây, Thau, Đũa, Vá","Ướp cá basa với gia vị 15 phút, Áp chảo cá chín vàng 5-7 phút rồi xé tơi, Ngâm và trụng miến dong mềm 5 phút, Trộn sốt sữa chua với tỏi và gia vị, Xếp rau củ tươi, miến và cá ra đĩa, Rưới sốt, trộn đều và thưởng thức ngay để cảm nhận độ tươi mát và vị béo ngậy hài hòa.","Người bận rộn, Gia đình, Người ăn Eat Clean","Người cần ăn nhiều năng lượng, Người dị ứng thành phần"
to-bun-gao-lut-ca-basa-ap-chao-cung-bong-cai-xanh,Bún gạo lứt Cá basa áp chảo cùng bông cải xanh,Trung,main,dinner,20,20,easy,420,23,40,9,9,484,2,40000,70000,eatclean,fish_sauce,savory,1,1,https://mrecohealthy.com/wp-content/uploads/2022/10/FRAME-16.jpg,"Tô bún gạo lứt Cá basa áp chảo cùng bông cải xanh là món ăn Eat Clean kiểu Việt, đủ đạm - tinh bột tốt - rau xanh, thích hợp cho người kiểm soát cân nặng.","Cá basa: 120g, bún gạo lứt: 100g, bông cải xanh: 100g, Dầu ôliu: 10ml, Nước mắm nhạt/ muối: 3g, Tiêu: 2g, Hành tỏi băm: 10g","Nồi hấp, Rây, Thau, Đũa, Vá","Ướp cá basa với hành tỏi băm, nước mắm nhạt và tiêu trong 15 phút, Luộc hoặc hấp bông cải xanh chín tới trong 3-4 phút, Chần bún gạo lứt qua nước sôi 1-2 phút rồi để ráo, Áp chảo cá với dầu ô liu trong 5-7 phút đến khi chín vàng hai mặt, Xếp bún ra đĩa, cá và bông cải xanh lên trên, Phần nước mắm chấm chua ngọt hoặc rưới chút nước tương, dùng ngay khi còn nóng để thưởng thức vị cá béo thơm hòa quyện với bún gạo lứt dai ngon và bông cải xanh giòn ngọt.","Người bận rộn, Gia đình, Người ăn Eat Clean","Người cần ăn nhiều năng lượng, Người dị ứng thành phần"
to-gao-lut-dau-hu-ap-chao-cung-ca-chua-bi,Gạo lứt Đậu hũ áp chảo cùng cà chua bi,Bắc,snack,dinner,15,20,medium,537,24,46,9,9,700,6,40000,80000,eatclean,soy,"fresh,light",1,1,https://mrecohealthy.com/wp-content/uploads/2022/11/bun-gao-lut-tron-rau-cu.jpg,"bún gạo lứt Đậu hũ áp chảo cùng cà chua bi là món ăn Eat Clean kiểu Việt, đủ đạm - tinh bột tốt - rau xanh, thích hợp cho người kiểm soát cân nặng.","Đậu hũ: 120g, gạo lứt: 100g, cà chua bi: 100g, Dầu ôliu: 10ml, Nước mắm nhạt/ muối: 3g, Tiêu: 2g, Hành tỏi băm: 10g","Nồi, Thớt, Dao, Muỗng, Đũa, Tô","Chần bún gạo lứt qua nước sôi 1-2 phút rồi để ráo, Áp chảo đậu hũ với dầu ô liu trong 6-8 phút đến khi vàng giòn hai mặt, Xào nhanh cà chua bi trong 2-3 phút cho hé vỏ, Xếp bún ra đĩa, đậu hũ và cà chua bi lên trên, Rưới nước tương pha tỏi ớt hoặc sốt mè rang, dùng ngay khi đậu hũ còn nóng giòn, tạo nên một bữa ăn nhẹ nhàng, bổ dưỡng và đầy màu sắc.","Người bận rộn, Gia đình, Người ăn Eat Clean","Người cần ăn nhiều năng lượng, Người dị ứng thành phần"
to-mien-dong-dau-hu-ap-chao-cung-ca-rot,Miến dong Đậu hũ áp chảo cùng cà rốt,Bắc,main,lunch,20,10,easy,453,16,49,13,8,695,7,25000,65000,eatclean,soy,"light,savory",0,1,https://i.ytimg.com/vi/S1FYEAgPyCE/maxresdefault.jpg,"Tô miến dong Đậu hũ áp chảo cùng cà rốt là món ăn Eat Clean kiểu Việt, đủ đạm - tinh bột tốt - rau xanh, thích hợp cho người kiểm soát cân nặng.","Đậu hũ: 120g, miến dong: 100g, cà rốt: 100g, Dầu ôliu: 10ml, Nước mắm nhạt/ muối: 3g, Tiêu: 2g, Hành tỏi băm: 10g","Nồi, Thớt, Dao, Muỗng, Đũa, Tô","Sơ chế và cắt nhỏ nguyên liệu, Luộc/hấp miến dong và cà rốt cho chín tới, Áp chảo hoặc luộc Đậu hũ cho chín, Sắp xếp vào tô/dĩa, rưới sốt nhẹ và dùng ngay","Người giảm cân, Người tập gym","Người cần ăn nhiều năng lượng, Người dị ứng thành phần"
com-mien-dong-ca-basa-bong-cai-xanh-eat-clean,Cơm miến dong Cá basa bông cải xanh eat clean,Nam,main,breakfast,15,20,easy,398,24,67,16,5,694,4,25000,55000,eatclean,fish_sauce,"fresh,light",1,1,https://cdn2.fptshop.com.vn/unsafe/Uploads/images/tin-tuc/165047/Originals/Nau-mien-hinh-6.jpg,"Cơm miến dong Cá basa bông cải xanh eat clean là món ăn Eat Clean kiểu Việt, đủ đạm - tinh bột tốt - rau xanh, thích hợp cho người kiểm soát cân nặng.","Cá basa: 120g, miến dong: 100g, bông cải xanh: 100g, Dầu ôliu: 10ml, Nước mắm nhạt/ muối: 3g, Tiêu: 2g, Hành tỏi băm: 10g","Chảo chống dính, Thớt, Dao, Muỗng, Dĩa","Sơ chế và cắt nhỏ nguyên liệu, Luộc/hấp miến dong và bông cải xanh cho chín tới, Áp chảo hoặc luộc Cá basa cho chín, Sắp xếp vào tô/dĩa, rưới sốt nhẹ và dùng ngay","Sinh viên, Người giảm cân","Người cần ăn nhiều năng lượng, Người dị ứng thành phần"
salad-dau-hu-bong-cai-xanh-sot-sua-chua,Salad Đậu hũ bông cải xanh sốt sữa chua,Bắc,main,lunch,20,10,medium,428,20,58,17,4,596,6,30000,60000,eatclean,soy,savory,0,1,https://img-global.cpcdn.com/recipes/79f313660f542a2d/1200x630cq80/photo.jpg,"Salad Đậu hũ bông cải xanh sốt sữa chua là món ăn Eat Clean kiểu Việt, đủ đạm - tinh bột tốt - rau xanh, thích hợp cho người kiểm soát cân nặng.","Đậu hũ: 120g, bún gạo lứt: 100g, bông cải xanh: 100g, Dầu ôliu: 10ml, Nước mắm nhạt/ muối: 3g, Tiêu: 2g, Hành tỏi băm: 10g","Nồi hấp, Rây, Thau, Đũa, Vá","Sơ chế và cắt nhỏ nguyên liệu, Luộc/hấp bún gạo lứt và bông cải xanh cho chín tới, Áp chảo hoặc luộc Đậu hũ cho chín, Sắp xếp vào tô/dĩa, rưới sốt nhẹ và dùng ngay","Sinh viên, Người giảm cân","Người cần ăn nhiều năng lượng, Người dị ứng thành phần"
mien-dong-tom-bi-do-eat-clean,Miến dong Tôm bí đỏ eat clean,Bắc,snack,lunch,20,10,medium,512,29,46,11,6,307,7,25000,45000,eatclean,shrimp,"light,savory",0,1,https://scontent.fdad3-4.fna.fbcdn.net/v/t39.30808-6/509223508_1406552287695899_2813803973792504226_n.jpg?stp=cp6_dst-jpg_tt6&_nc_cat=100&ccb=1-7&_nc_sid=127cfc&_nc_ohc=yRIbyFf-LlIQ7kNvwG0NC_q&_nc_oc=AdkGM3bwPcaMVigzreeUaKscZah7P3fE94TXOtjLyiAZye-rbACka4ENgClc4RInri4&_nc_zt=23&_nc_ht=scontent.fdad3-4.fna&_nc_gid=9Z7PmcEd0yeMbXUWi-Td3Q&oh=00_AfkYB40pOMJWYhGwSKpAYNLqFs_cdCTkT1j8s6p5JilngQ&oe=6939E88B,"Miến dong tôm bí đỏ eat clean là món ăn nhẹ nhàng, ít tinh bột xấu, kết hợp miến dong dai mềm, tôm tươi giàu đạm và bí đỏ ngọt tự nhiên. Món ăn có màu sắc bắt mắt, dễ tiêu, phù hợp cho thực đơn giảm cân, giữ dáng hoặc ăn uống lành mạnh hằng ngày.","Miến dong: 80g, Tôm tươi bóc vỏ: 120g, Bí đỏ: 150g, Cải bó xôi hoặc cải thìa: 80g, Hành tây: 40g, Tỏi băm: 5g, Dầu ôliu: 5ml, Muối: 1g, Tiêu: 1g, Nước lọc: 100ml, Nước tương: 5ml","Nồi hấp, Rây, Thau, Đũa, Vá","Ngâm miến dong cho mềm rồi để ráo, Hấp hoặc luộc bí đỏ đến khi mềm, Xào tỏi với dầu ôliu rồi cho tôm vào đảo chín, Thêm hành tây cải bó xôi và bí đỏ vào đảo đều, Cho miến dong vào và nêm muối tiêu cùng chút nước tương, Xào đến khi thấm vị rồi trình bày ra dĩa","Sinh viên, Người giảm cân","Người cần ăn nhiều năng lượng, Người dị ứng thành phần"
bun-bun-gao-lut-tom-tron-rau-song,Bún  gạo lứt Tôm trộn rau sống,Trung,main,breakfast,20,20,medium,494,15,67,9,6,525,2,25000,55000,eatclean,shrimp,savory,1,1,https://img-global.cpcdn.com/recipes/fb0d3ea095929cd0/1200x630cq80/photo.jpg,"Bún gạo lứt Tôm trộn rau sống là món ăn Eat Clean kiểu Việt, đủ đạm - tinh bột tốt - rau xanh, thích hợp cho người kiểm soát cân nặng.","Tôm: 120g, bún gạo lứt: 100g, cải bó xôi: 100g, Dầu ôliu: 10ml, Nước mắm nhạt/ muối: 3g, Tiêu: 2g, Hành tỏi băm: 10g","Chảo chống dính, Thớt, Dao, Muỗng, Dĩa","Sơ chế tôm và ngâm bún gạo lứt cho mềm; trụng bún với nước sôi và để ráo, Phi thơm hành tỏi với dầu ô liu 1 phút, Xào tôm 3–4 phút đến khi săn và hồng, Nêm nước mắm nhạt/ muối và tiêu, Trụng nhanh cải bó xôi hoặc để sống, Trộn bún – tôm – cải bó xôi với chút dầu ô liu, Trình bày ra tô và thưởng thức.","Người giảm cân, Người tập gym","Người cần ăn nhiều năng lượng, Người dị ứng thành phần"
salad-ma-dui-ga,Salad má đùi gà,Bắc,main,breakfast,15,20,medium,505,28,57,15,6,265,2,40000,70000,eatclean,shrimp,"fresh,light",1,1,https://img-global.cpcdn.com/recipes/85f287d3b00cba48/300x426f0.5_0.500105_1.0q80/salad-ma-dui-ga-eatclean-recipe-main-photo.webp,"Salad má đùi gà là món ăn eat clean giàu đạm, ít tinh bột và giàu chất xơ. Má đùi gà mềm mọng, kết hợp rau xanh và sốt dầu ôliu – chanh giúp món salad thanh nhẹ nhưng vẫn đủ năng lượng cho bữa ăn lành mạnh.","Má đùi gà: 150g, Xà lách: 80g, Dưa leo: 60g, Cà chua bi: 60g, Hành tây lát mỏng: 20g, Bơ chín: 50g, Dầu ôliu: 10ml, Nước cốt chanh: 5ml, Muối: 1g, Tiêu: 1g","Chảo chống dính, Thớt, Dao, Muỗng, Dĩa","Ướp má đùi gà với muối tiêu rồi áp chảo đến khi chín, Rửa và sơ chế rau củ, Cắt gà thành miếng và trộn cùng xà lách dưa leo cà chua bi bơ và hành tây, Rưới dầu ôliu và nước chanh, Trộn đều và trình bày ra dĩa","Người giảm cân, Người tập gym","Người cần ăn nhiều năng lượng, Người dị ứng thành phần"
uc-ga-sot-cam,Ức gà sốt cam,Nam,main,lunch,15,20,medium,383,16,42,11,6,349,4,35000,55000,eatclean,fish_sauce,"fresh,light",1,1,https://img-global.cpcdn.com/recipes/34090b0a87ccad36/300x426f0.5_0.496366_1.0q80/eat-clean-%E1%BB%A9c-ga-s%E1%BB%91t-cam-recipe-main-photo.webp,"Ức gà sốt cam là món ăn eat clean giàu protein, ít chất béo, kết hợp vị chua ngọt tự nhiên của cam với ức gà mềm thơm. Món ăn thanh nhẹ nhưng đủ dưỡng chất, phù hợp cho bữa trưa hoặc tối lành mạnh, hỗ trợ giảm cân và giữ dáng.","Ức gà: 150g, Nước cam vắt: 80ml, Vỏ cam bào nhuyễn: 2g, Tỏi băm: 5g, Mật ong: 5g, Muối: 1g, Tiêu: 1g, Dầu ôliu: 5ml, Nước lọc: 20ml","Nồi, Thớt, Dao, Muỗng, Đũa, Tô","Ướp ức gà với muối tiêu và tỏi, Áp chảo ức gà đến khi vàng hai mặt, Pha sốt cam gồm nước cam mật ong vỏ cam và nước lọc rồi đổ vào chảo, Rim lửa nhỏ đến khi sốt sệt và thấm vào gà, Cắt lát và trình bày ra dĩa","Người bận rộn, Gia đình, Người ăn Eat Clean","Người cần ăn nhiều năng lượng, Người dị ứng thành phần"
khoai-lang-ca-basa-ap-chao-cung-rau-cu-tong-hop,Khoai lang Cá basa áp chảo cùng rau củ tổng hợp,Nam,main,dinner,20,20,medium,454,25,49,12,7,648,3,35000,55000,eatclean,fish_sauce,savory,0,1,https://i.ytimg.com/vi/avTVASFjUQU/hq720.jpg?sqp=-oaymwEhCK4FEIIDSFryq4qpAxMIARUAAAAAGAElAADIQj0AgKJD&rs=AOn4CLBQV9w8GT6YvKjp7xTvoJLLAIZ2iA,"Khoai lang cá basa áp chảo cùng rau củ tổng hợp là món ăn eat clean đơn giản, lành mạnh với sự kết hợp giữa khoai lang giàu chất xơ, cá basa giàu đạm và nhóm rau củ giàu vitamin. Món ăn nhẹ bụng, dễ tiêu, phù hợp cho thực đơn giảm cân hoặc duy trì vóc dáng.","Khoai lang hấp: 180g, Cá basa phi lê: 150g, Bông cải xanh: 80g, Cà rốt: 50g, Đậu que: 60g, Dầu ôliu: 8ml, Muối: 1g, Tiêu: 1g, Tỏi băm: 5g, Nước cốt chanh: 5ml","Chảo, Nồi, Đũa, Thớt, Dao, Chén","Hấp khoai lang đến khi chín mềm, Sơ chế và luộc bông cải cà rốt và đậu que chín tới, Ướp cá basa với muối tiêu và tỏi rồi áp chảo đến khi vàng thơm, Xếp khoai lang rau củ và cá ra dĩa, Rưới dầu ôliu và nước chanh, Trình bày và thưởng thức","Người giảm cân, Người tập gym","Người cần ăn nhiều năng lượng, Người dị ứng thành phần"
salad-tom-cai-bo-xoi-sot-sua-chua,Salad Tôm cải bó xôi sốt sữa chua,Bắc,snack,lunch,20,15,medium,417,24,57,16,8,708,3,30000,70000,eatclean,shrimp,"light,savory",0,1,https://img-global.cpcdn.com/recipes/a0fa1c43289c8089/1200x630cq80/photo.jpg,"Salad tôm cải bó xôi sốt sữa chua là món ăn thanh mát, ít calo nhưng giàu đạm và vitamin. Tôm áp chảo thơm ngọt kết hợp cải bó xôi tươi và sốt sữa chua béo nhẹ tạo nên món salad hài hòa, phù hợp cho thực đơn eat clean, giảm cân hoặc bữa ăn nhẹ dinh dưỡng.","Tôm tươi bóc vỏ: 120g, Cải bó xôi: 80g, Dưa leo: 60g, Cà chua bi: 60g, Sữa chua không đường: 80g, Nước cốt chanh: 5ml, Dầu ôliu: 5ml, Muối: 1g, Tiêu: 1g, Tỏi băm: 3g","Chảo chống dính, Thớt, Dao, Muỗng, Dĩa","Ướp tôm với muối tiêu và tỏi rồi áp chảo đến khi chín, Rửa sạch cải bó xôi dưa leo và cà chua bi, Trộn sữa chua với nước chanh và dầu ôliu làm sốt, Cho tôm và rau củ vào tô trộn đều với sốt sữa chua, Trình bày ra dĩa và thưởng thức","Sinh viên, Người giảm cân","Người cần ăn nhiều năng lượng, Người dị ứng thành phần"
bun-gao-lut-tron-rau-cu-thit-bo,Bún gạo lứt trộn rau củ thịt bò,Nam,main,breakfast,20,15,easy,346,25,51,11,8,689,4,30000,50000,eatclean,fish_sauce,"light,savory",0,1,https://cdn.tgdd.vn/2021/05/CookRecipe/Avatar/bun-gao-lut-tron-rau-cu-thit-bo-thumbnail.jpg,"Bún gạo lứt trộn rau củ thịt bò là món eat clean cân bằng giữa tinh bột tốt, đạm nạc và chất xơ. Bò áp chảo mềm thơm, rau củ tươi giòn kết hợp bún gạo lứt giúp món ăn vừa no lâu vừa nhẹ bụng, phù hợp cho thực đơn giảm cân và giữ dáng.","Bún gạo lứt: 150g, Thịt bò thăn: 120g, Dưa leo: 60g, Cà rốt: 50g, Bắp cải tím: 60g, Rau xà lách: 50g, Tỏi băm: 5g, Dầu ôliu: 5ml, Nước cốt chanh: 5ml, Nước tương: 5ml, Muối: 1g, Tiêu: 1g","Nồi hấp, Rây, Thau, Đũa, Vá","Luộc bún gạo lứt rồi để ráo, Áp chảo thịt bò đã ướp muối tiêu và tỏi rồi cắt lát, Sơ chế và cắt sợi rau củ, Trộn bún với rau củ và bò cùng nước tương dầu ôliu và nước chanh, Trình bày ra tô và thưởng thức","Sinh viên, Người giảm cân","Người cần ăn nhiều năng lượng, Người dị ứng thành phần"
bun-bun-gao-lut-ca-hoi-tron-rau-song,Bún gạo lứt Cá hồi trộn rau sống,Bắc,main,breakfast,15,15,easy,395,22,63,10,7,278,4,25000,55000,eatclean,fish_sauce,"light,savory",0,1,"https://photos.tryotter.com/cdn-cgi/image/fit=crop,width=492,height=267,quality=60,format=auto/menu-photos/13183c96-f70d-413f-9548-f7c8a8bd3e79.jpeg","Bún gạo lứt cá hồi trộn rau sống là món eat clean giàu đạm, omega-3 và chất xơ. Cá hồi áp chảo béo mềm hòa cùng rau sống tươi mát và bún gạo lứt giúp món ăn thanh nhẹ, dinh dưỡng và rất phù hợp cho thực đơn giảm cân hoặc bữa trưa nhanh gọn lành mạnh.","Bún gạo lứt: 150g, Cá hồi phi lê: 120g, Xà lách: 60g, Dưa leo: 60g, Cà rốt: 40g, Rau thơm: 20g, Dầu ôliu: 5ml, Nước cốt chanh: 5ml, Muối: 1g, Tiêu: 1g, Tỏi băm: 3g","Nồi hấp, Rây, Thau, Đũa, Vá","Luộc bún gạo lứt rồi để ráo, Ướp cá hồi với muối tiêu và tỏi rồi áp chảo vàng thơm, Sơ chế và cắt nhỏ rau sống dưa leo và cà rốt, Trộn bún với rau sống và cá hồi cắt miếng, Rưới dầu ôliu và nước chanh rồi trộn đều và thưởng thức","Người bận rộn, Gia đình, Người ăn Eat Clean","Người cần ăn nhiều năng lượng, Người dị ứng thành phần"
com-yen-mach-rang,Cơm yến mạch rang,Trung,main,breakfast,15,20,medium,304,23,49,18,7,687,4,25000,65000,eatclean,soy,"fresh,light",1,1,https://img-global.cpcdn.com/recipes/783a715c0ea27b37/680x781cq80/c%C6%A1m-y%E1%BA%BFn-m%E1%BA%A1ch-rang-eat-clean-recipe-main-photo.jpg,"Cơm yến mạch rang eat clean là món ăn ít tinh bột xấu, nhiều chất xơ và giàu dinh dưỡng. Yến mạch được rang thơm rồi xào cùng rau củ, tạo thành món ""cơm"" nhẹ bụng, no lâu nhưng không gây tăng cân, rất phù hợp cho người giảm cân hoặc duy trì lối sống lành mạnh.","Yến mạch cán dẹt: 80g, Trứng: 50g, Cà rốt: 40g, Đậu Hà Lan: 40g, Bắp hạt: 40g, Hành tây: 30g, Tỏi băm: 3g, Dầu ôliu: 5ml, Muối: 1g, Tiêu: 1g, Nước lọc: 30ml","Chảo chống dính, Thớt, Dao, Muỗng, Dĩa","Rang yến mạch trên chảo khô đến khi thơm, Xào hành tỏi rồi cho cà rốt đậu Hà Lan và bắp vào, Thêm yến mạch và đảo nhanh tay, Nêm muối tiêu và thêm chút nước cho yến mạch mềm, Có thể thêm trứng đảo cùng nếu muốn, Trình bày ra dĩa và thưởng thức","Người bận rộn, Gia đình, Người ăn Eat Clean","Người cần ăn nhiều năng lượng, Người dị ứng thành phần"
bun-gao-lut-trung-ga-cung-rau-cu,Bún gạo lứt Trứng gà cùng rau củ,Trung,main,dinner,15,10,medium,537,21,46,14,8,370,4,40000,60000,eatclean,egg,savory,1,1,https://foodpeoplevn.com/wp-content/uploads/2020/06/8820aa3bf8de2d8074cf-1024x768.jpg,"Bún gạo lứt trứng gà cùng rau củ là món eat clean thanh nhẹ, giàu chất xơ và protein. Sợi bún gạo lứt dai mềm kết hợp trứng gà và rau củ nhiều màu sắc tạo nên bữa ăn cân bằng dinh dưỡng, phù hợp cho bữa trưa hoặc tối lành mạnh.","Bún gạo lứt: 150g, Trứng gà luộc: 50g, Cải thìa hoặc cải ngọt: 80g, Cà rốt: 40g, Bắp hạt: 40g, Dầu ôliu: 5ml, Nước tương ít muối: 5ml, Muối: 1g, Tiêu: 1g, Tỏi băm: 3g","Chảo chống dính, Thớt, Dao, Muỗng, Dĩa","Luộc bún gạo lứt rồi để ráo, Luộc cải và cà rốt cùng bắp đến khi chín tới, Áp chảo hoặc luộc trứng tùy thích, Trộn bún với rau củ và trứng rồi nêm dầu ôliu nước tương muối tiêu, Trình bày ra tô và thưởng thức","Người bận rộn, Gia đình, Người ăn Eat Clean","Người cần ăn nhiều năng lượng, Người dị ứng thành phần"
bun-gao-lut-xao-dau-que-uc-ga,Bún gạo lứt xào đậu que với ức gà,Trung,main,lunch,20,15,medium,547,25,68,18,6,305,2,35000,55000,eatclean,none,savory,0,1,https://img-global.cpcdn.com/recipes/c01a4a9acad0d3e1/300x426f0.5_0.501211_1.0q80/bun-l%E1%BB%A9t-xao-d%E1%BA%ADu-que-%E1%BB%A9c-ga-eatclean-recipe-main-photo.webp,"Bún lứt xào đậu que và ức gà là món eat clean giàu đạm, ít tinh bột xấu và giàu chất xơ. Sợi bún lứt dai mềm kết hợp ức gà áp chảo và đậu que giòn ngọt tạo nên món ăn thanh nhẹ, giúp no lâu nhưng không gây nặng bụng, rất phù hợp cho thực đơn giảm cân.","Bún gạo lứt: 150g, Ức gà: 150g, Đậu que: 80g, Cà rốt: 40g, Hành tây: 30g, Tỏi băm: 5g, Dầu ôliu: 5ml, Muối: 1g, Tiêu: 1g, Nước tương ít muối: 5ml","Nồi hấp, Rây, Thau, Đũa, Vá","Luộc bún lứt rồi để ráo, Áp chảo ức gà đã ướp muối tiêu và cắt sợi, Xào tỏi với dầu ôliu rồi cho đậu que cà rốt và hành tây vào, Thêm bún và thịt gà vào xào chung, Nêm nước tương muối tiêu cho vừa ăn, Trình bày ra dĩa và thưởng thức","Người giảm cân, Người tập gym","Người cần ăn nhiều năng lượng, Người dị ứng thành phần"
mien-ca-sot-ca-chua,Miến cá sốt cà chua,Bắc,main,lunch,10,10,medium,435,19,47,18,4,512,6,25000,65000,eatclean,fish_sauce,"fresh,light",1,1,https://cdn.tgdd.vn/Files/2020/10/26/1302139/giam-can-hieu-qua-cung-mon-mien-ca-vua-ngon-mieng-lai-vua-de-nau-202010261350155569.jpg,"Miến cá basa sốt cà chua eat clean là món ăn thanh nhẹ, kết hợp miến dong dai mềm với cá basa áp chảo và sốt cà chua chua ngọt tự nhiên. Món ăn dễ tiêu, giàu đạm, ít tinh bột xấu, phù hợp cho thực đơn giảm cân và ăn uống lành mạnh.","Miến dong: 80g, Cá basa phi lê: 150g, Cà chua: 120g, Hành tây: 30g, Tỏi băm: 5g, Dầu ôliu: 5ml, Muối: 1g, Tiêu: 1g, Nước lọc: 50ml, Nước cốt chanh: 5ml","Chảo, Nồi, Đũa, Thớt, Dao, Chén","Ngâm miến cho mềm và để ráo, Áp chảo cá basa đã ướp muối tiêu rồi để sang một bên, Phi thơm tỏi hành tây rồi cho cà chua vào nấu mềm, Thêm nước lọc và nêm muối tiêu cho vừa ăn để tạo sốt, Cho miến vào đảo đều với sốt cà chua, Xếp cá basa lên trên và rưới nước chanh trước khi dùng","Người giảm cân, Người tập gym","Người cần ăn nhiều năng lượng, Người dị ứng thành phần"
com-gao-lut-cuon-rong-bien,Cơm gạo lứt cuộn rong biển,Trung,main,lunch,10,20,easy,536,19,68,15,7,535,3,30000,50000,eatclean,fish_sauce,savory,1,1,https://cdn.tgdd.vn/2020/07/CookProduct/1112-1200x676-2.jpg,"Cơm cuộn gạo lứt cuộn rong biển là món ăn eat clean thanh nhẹ, giàu chất xơ và vitamin. Gạo lứt dẻo mềm cuộn cùng rau củ tươi tạo nên món ăn no lâu nhưng không gây tăng cân. Thích hợp cho bữa trưa, bữa tối lành mạnh hoặc mang đi làm.","Gạo lứt nấu chín: 180g, Rong biển cuộn: 2 lá, Cà rốt: 40g, Dưa leo: 60g, Bơ chín: 50g, Trứng chiên mỏng: 50g, Giấm táo: 5ml, Dầu mè: 3ml, Muối: 1g, Mè rang: 5g","Nồi hấp, Rây, Thau, Đũa, Vá","Trộn cơm gạo lứt với giấm táo muối và dầu mè, Cắt cà rốt dưa leo và bơ thành thanh dài, Trải rong biển và dàn cơm lên mặt rồi xếp rau củ và trứng lên, Cuộn chặt và cắt khoanh, Rắc mè rang và thưởng thức","Người bận rộn, Gia đình, Người ăn Eat Clean","Người cần ăn nhiều năng lượng, Người dị ứng thành phần"
