id,name_vi,region,category,meal_types,prep_time_min,cook_time_min,difficulty,calories,protein_g,carbs_g,fat_g,fiber_g,sodium_mg,sugar_g,price_est_vnd_min,price_est_vnd_max,diet_tags,allergens,taste_profile,spice_level,servings,image_url,description,ingredients,utensils,steps,suitable_for,avoid_for
banh-canh,Bánh canh,Nam,main,lunch,20,20,medium,420,18,55,10,3,900,4,30000,60000,balanced,"shrimp,gluten","savory,umami",1,1,https://encrypted-tbn0.gstatic.com/images?q=tbn:ANd9GcR9kZCL_b-StEtBUCsH8DixwVUFCtkwC2gvOg&s,"Được làm từ bột gạo, bột mì, hoặc bột sắn hoặc bột gạo pha bột sắn cán thành tấm và cắt ra thành sợi to và ngắn với nước dùng được nấu từ tôm, cá, giò heo... thêm gia vị tùy theo từng loại","Tôm: 500g, Sườn heo: 800g, Nấm hương: 100g, Hành tím: 2 củ, Chanh: 1 trái, Ớt: 4 trái, Hành tây: 1 củ, Hạt điều màu: 100g, Tỏi: 1 củ, Củ cải trắng: 400g, Hành lá: 15g, Ngò rí: 10g, Tinh bột khoai tây: 1 muỗng canh, Tinh bột bắp: 1 muỗng canh, Đường phèn: 20g, Rượu nấu ăn: 1 ít, Dầu ăn: 65ml","Nồi, Chén, Muỗng, Thớt, Vá, Rây","Hầm sườn non làm nước dùng, Nấu vỏ tôm lấy nước cho vào nồi sườn, Trộn tôm xay với giò sống làm chả tôm, Nấu và nặn sợi bánh canh rồi xả lạnh, Phi hành tỏi với dầu điều đổ vào nồi và nêm gia vị, Nặn chả tôm vào nồi nước dùng, Cho bánh canh và bột năng vào khuấy đến sánh, Múc ra tô rắc hành và thưởng thức","Bữa tiệc, Trẻ em, Người lớn tuổi",Người ăn chay
banh-a-cua,Bánh đa cua,Bắc,main,dinner,20,20,medium,500,20,60,15,3,900,5,35000,65000,balanced,"crab,gluten","savory,umami",1,1,https://i-giadinh.vnecdn.net/2023/02/25/Buoc-12-thanh-pham-12-3879-1677318715.jpg,Bánh đa với nước dùng riêu cua,"Bánh đa đỏ: 400g, Cua đồng xay: 400g, Sườn: 300g, Thịt lợn xay: 150g, Chả cá - mỡ phần - tôm khô: 100g, Rau muống: 50g, Cà chua: 6 quả, Rau sống: 100g, Mộc nhĩ: 20g, Lá lốt: 10g, Hành khô: 10g, Hành lá - mùi tàu: 10g, Chanh: 3 quả","Chảo, Nồi hấp, Nồi, Chén, Tô, Rây","Luộc sơ sườn rồi hầm với hành nướng và gia vị, Lọc cua nấu lên cho gạch nổi rồi trút nước hầm sườn vào, Phi hành xào cà chua cho màu và cho vào nồi nước dùng, Xào gạch cua với mắm rồi để riêng, Chiên tóp mỡ và hành phi rồi thêm cà chua vào nồi nước dùng, Làm chả thịt mộc nhĩ nấm hương và rán chín, Hấp bóc nõn tôm rồi rim đến khi săn dai, Ngâm bánh đa cho nở và chuẩn bị rau hành mùi tàu","Trẻ em, Bữa tiệc, Sinh viên",Người ăn chay
bun-bo-hue,Bún bò Huế,Trung,main,breakfast,20,20,medium,420,18,55,10,3,900,4,30000,60000,balanced,"shrimp,fish_sauce","savory,umami",1,1,https://i.pinimg.com/736x/04/b6/f9/04b6f958f5f053fbaefccddd1007aa48.jpg,"Bún đặc sản của xứ Huế, trong nước dùng có một ít mắm ruốc, góp phần làm nên hương vị rất riêng","Giò sống: 33g, Thịt heo: 169g, Bún tươi: 97g, Dầu ăn: 34g, Rau thơm: 180g, Ớt: 169g","Đũa, Nồi hấp, Tô, Chén, Vá, Kéo","Nướng hành gừng cho thơm rồi rửa sạch, Hầm xương heo với sả để lấy nước dùng trong, Thêm mắm ruốc Huế, nêm muối đường nước mắm, Trụng bún qua nước sôi, Xếp bắp bò giò heo chả vào tô, chan nước dùng, thêm rau muống bào và hoa chuối","Người bận rộn, Người lớn tuổi, Trẻ em",Người ăn chay
bun-bung,Bún bung,Bắc,main,breakfast,20,20,medium,500,20,60,15,3,900,5,35000,65000,balanced,fish_sauce,"savory,umami",1,1,https://i-giadinh.vnecdn.net/2024/07/13/Buoc-7-Thanh-pham-7-3169-1720857533.jpg,Bún nấu với sườn lợn và dọc mùng,"Bún tươi: 400g, Sườn non: 300g, Dọc mùng: 200g, Cà chua: 3 quả, Nghệ tươi: 1 củ, Mẻ hoặc me chua: 30g, Mắm tôm: 10g, Hành khô: 10g, Hành lá: 20g, Rau răm: 10g, Ớt tươi: 5g, Nước mắm: 15ml, Muối: 5g, Dầu ăn: 20ml","Rây, Thớt, Đũa, Tô","Chần sơ sườn rồi hầm nhừ và hớt bọt, Chuẩn bị dọc mùng bóp muối và xào cà chua với hành tím, Trộn thịt băm nấm mèo giò sống rồi vo viên, Cho thịt viên vào nồi sườn nấu chín rồi thêm cà chua dọc mùng và hành lá","Sinh viên, Người bận rộn, Gia đình",Người ăn chay
bun-ca,Bún cá,Bắc,main,lunch,20,20,medium,420,18,55,10,3,900,4,30000,60000,balanced,fish_sauce,"savory,umami",1,1,https://i.ytimg.com/vi/D95V3tP_MGA/maxresdefault.jpg,"Bún và chả cá nướng trộn nước mắm, rau sống","Cá rô phi: 800g, Bún tươi: 500g, Xương heo: 400g, Đậu hũ non: 2 miếng, Hành khô: 10g, Mắm tôm: 1.2 muỗng canh , Nước cốt chanh: 1.2 muỗng, Bột nghệ: 1.2 muỗng cà phê, Rau ăn kèm: 100g","Đũa, Dao, Thớt, Chén, Muỗng, Tô","Chần sơ xương heo và xương cá rồi ninh cùng nước để làm nước dùng, Sơ chế cá rô phi cắt lát và chuẩn bị cà chua hành rau thì là đậu hũ, Ướp cá với chanh mắm tôm bột ngọt và bột nghệ, Chiên đậu hũ vàng giòn và chiên cá phủ bột cho giòn đều, Phi hành xào cà chua với bột nghệ rồi cho vào nồi nước dùng và nêm gia vị","Gia đình, Người lớn tuổi, Bữa tiệc",Người ăn chay
bun-cha,Bún chả,Bắc,main,lunch,20,20,medium,500,20,60,15,3,900,5,35000,65000,balanced,"pork,fish_sauce","savory,umami",1,1,https://i-giadinh.vnecdn.net/2023/04/16/Buoc-11-Thanh-pham-11-7068-1681636164.jpg,Bún ăn kèm chả viên và chả miếng với nước chấm,"Bún tươi: 1kg, Thịt ba chỉ: 700g, Thịt heo xay nhuyễn: 500g, Cà rốt: 1 củ, Đu đủ xanh: 1/2 trái, Rau sống các loại: 500g, Hành tím băm: 1 muỗng canh, Tỏi băm: 1.5 muỗng canh, Ớt băm: 1 ít, Dầu hào: 2 muỗng canh, Mật ong: 3 muỗng canh, Nước màu: 2 muỗng canh, Nước mắm: 1 chén, Giấm: 1/2 chén","Nồi, Tô, Dao, Thớt, Chén","Ướp thịt ba chỉ và thịt xay rồi vo viên, Sơ chế cà rốt đu đủ và ngâm chua ngọt, Nướng thịt ba chỉ và thịt viên đến vàng đều, Nấu nước mắm pha giấm đường nước cho sôi, Xếp thịt bún rau và chan nước mắm cùng cà rốt đu đủ","Gia đình, Trẻ em, Sinh viên",Người ăn chay
bun-mang-vit,Bún măng vịt,Trung,main,breakfast,20,20,medium,500,20,60,15,3,900,5,35000,65000,balanced,"chicken,fish_sauce","savory,umami",1,1,https://i.ytimg.com/vi/IQUykuEF3kk/hq720.jpg?sqp=-oaymwEhCK4FEIIDSFryq4qpAxMIARUAAAAAGAElAADIQj0AgKJD&rs=AOn4CLC0Z_JzBueYNN7fm_ofhyic9LH4aA,Bún măng dùng với nước hầm xương vịt,"Vịt: 700g, Măng tươi: 250g, Nấm rơm: 500g, Tiết vịt: 100g, Bún tươi: 1kg, Rượu trắng: 100ml, Gừng: 2 nhánh, Hành tím: 4 củ, Tỏi : 1 củ, Hành lá: 2 nhánh, Rau mùi: 10g, Rau răm: 10g, Ớt: 2 trái","Muỗng, Tô, Rây, Kéo","Sơ chế thịt vịt khử mùi rồi chặt miếng, Ướp vịt với gừng tỏi hành và gia vị, Luộc măng rồi cắt miếng, Sơ chế nấm rơm huyết bún và rau ăn kèm, Xào măng với gia vị cho thấm, Xào thịt vịt cho săn, Nấu nước dùng với thịt vịt nấm rơm huyết và măng rồi nêm lại, Giã tỏi ớt gừng pha nước chấm","Trẻ em, Bữa tiệc, Gia đình",Người ăn chay
bun-cha-ca,Bún chả cá,Trung,main,dinner,20,20,medium,500,20,60,15,3,900,5,35000,65000,balanced,fish_sauce,"savory,umami",1,1,https://i.ytimg.com/vi/D95V3tP_MGA/maxresdefault.jpg,Bún với chả cá chan nước dùng nóng,"Cá basa: 1 con, Chả hấp: 500g, Chả chiên: 500g, Bí đỏ: 500g, Bắp cải: 200g, Cà chua: 3 quả, Thơm: 1 trái, Rau ăn kèm: 1 ít, Dầu ăn: 1 muỗng canh, Nước mắm: 6 muỗng canh, Bột tỏi: 1/2 muỗng cà phê","Nồi, Dao, Thớt, Rây, Chén, Chảo","Sơ chế bí đỏ bắp cải cà chua thơm, Phi tỏi xào cà chua, Nấu nước lèo với bí đỏ bắp cải thơm và nêm gia vị, Sơ chế cá basa cắt khúc, Kho cá với đường nước mắm tiêu và nước, Cho chả cá vào nồi nước lèo nấu sôi và nêm lại","Gia đình, Sinh viên, Người lớn tuổi",Người ăn chay
bun-chao-tom,Bún chạo tôm,Trung,main,lunch,20,20,medium,500,20,60,15,3,900,5,35000,65000,balanced,shrimp,"savory,umami",1,1,https://encrypted-tbn0.gstatic.com/images?q=tbn:ANd9GcTME6kU10DMpGPG8dl_HA99vuYB5k7G_IwX3g&s,"Tôm xiên vào que mía nướng ăn kèm bún, rau sống","Tôm xay nhuyễn: 250g, Bột năng: 5 muỗng canh, Giò sống: 200g, Tiêu trắng: 1/2 muỗng cà phê, Dầu hào: 1 muỗng canh, Nước mắm: 1 muỗng canh, Lòng trắng trứng gà: 1 cái, Đường: 1/2 muỗng cà phê, Mía lau: 5 thanh, Cà rốt thái nhỏ: 2 muỗng canh, Hành lá thái nhỏ: 1 nhánh nhỏ","Chảo, Nồi hấp, Kéo, Đũa, Rây, Dao","Pha nước sốt với tương ớt đường giấm nước mắm rồi trộn cà rốt củ cải đậu phộng, Quết giò sống với bột năng lòng trắng trứng hành tiêu đường nước mắm và dầu hào, Trộn cà rốt vào hỗn hợp rồi ướp lạnh cho cứng, Quấn chạo tôm quanh thanh mía, Chiên chạo tôm ngập dầu đến vàng đều","Trẻ em, Người lớn tuổi, Sinh viên",Người ăn chay
bun-au-mam-tom,Bún đậu mắm tôm,Bắc,main,dinner,20,20,medium,500,20,60,15,3,900,5,35000,65000,balanced,"shrimp,fish_sauce","savory,umami",1,1,https://i-giadinh.vnecdn.net/2025/05/16/Bun-dau-mam-tom-6-vnexpress-17-9082-8722-1747388531.jpg,Bún ăn với đậu rán và mắm tôm,"Bún lá: 1 ít, Đậu hũ: 1kg, Phèo non: 600g, Gan: 200g, Huyết: 100g, Dạ dày: 300g, Lưỡi heo: 1 cái, Thịt heo: 500g, Thịt heo xay: 300g, Khoai tây: 1 củ, Nấm mèo: 500g, Ớt: 2 trái, Dưa leo: 3 quả, Chanh: 2 quả, Rau ăn kèm: 1 ít, Hành tím: 4 củ, Tỏi: 4 tép, Gừng: 1 củ, Bánh tráng rế: 15 cái, Mắm tôm: 500g, Giấm: 100ml, Dầu ăn: 500ml","Rây, Vá, Kéo, Tô, Nồi, Dao","Sơ chế sạch thịt lưỡi gan phèo non và dạ dày, Luộc gan dạ dày phèo non rồi luộc thịt và lưỡi riêng, Chiên đậu hũ và chuẩn bị rau dưa khoai tây nấm mèo hành tỏi, Trộn nhân thịt cuốn ram rồi chiên giòn, Pha mắm tôm với đường bột ngọt tỏi ớt và chanh đánh bông","Trẻ em, Sinh viên, Người lớn tuổi",Người ăn chay
bun-mam,Bún mắm,Nam,main,lunch,20,20,medium,420,18,55,10,3,900,4,30000,60000,balanced,fish_sauce,"savory,umami",1,1,https://file.hstatic.net/200000714303/file/bun-mam-nem-1_c86c473587ce4df9b2b92283a951aa5f_grande.jpg,Bún chan nước dùng làm từ mắm cá linh hay cá sặc,"Heo quay: 200g, Cá diêu hồng: 800g, Chả cá thác lác: 200g, Tôm: 400g, Mực: 300g, Mắm cá sặc: 300g, Cà tím: 2 trái, Thơm: 1/2 trái, Ớt: 3 trái, Hành tím: 2 củ, Sả: 3 tép, Ớt sừng: 5 trái, Hành lá: 3 nhánh, Hẹ: 20g, Rau ăn kèm: 1 ít, Bún tươi: 500g, Nước mắm: 1/2 muỗng cà phê, Dầu ăn: 7 muỗng canh","Tô, Chén, Vá, Nồi hấp, Đũa, Dao","Sơ chế sả hành rau thơm cá diêu hồng mực và heo quay, Nấu mắm cá sặc lọc lấy nước, Trộn chả cá nhồi ớt rồi chiên vàng, Luộc tôm mực cá diêu hồng, Nấu nước dùng với mắm cá thơm nước luộc hải sản và sả ớt phi rồi cho cà tím nêm lại, Xếp bún tôm mực cá heo quay chả ớt chan nước dùng","Gia đình, Người bận rộn, Bữa tiệc",Người ăn chay
bun-moc,Bún mọc,Bắc,main,breakfast,20,20,medium,500,20,60,15,3,900,5,35000,65000,balanced,"pork,fish_sauce","savory,umami",1,1,https://vcdn1-giadinh.vnecdn.net/2021/01/02/Anh-6-7105-1609558348.jpg?w=460&h=0&q=100&dpr=2&fit=crop&s=o9uZITxyU-0sd6y4cmG-_w,Bún với mọc chan nước dùng,"Sườn non: 400g, Giò sống: 250g, Xương ống: 300g, Bún tươi: 1kg, Chả lụa: 200g, Mộc nhĩ: 60g, Hành lá: 5 nhánh, Rau mùi: 1 bó, Hành tím: 3 củ, Rau sống: 300g, Gia vị thông dụng: 50g","Nồi hấp, Dao, Đũa, Muỗng, Rây","Trụng xương ống rồi hầm với gia vị và sơ chế sườn ướp nhẹ, Sơ chế mộc nhĩ chả lụa hành rau và trụng bún, Trộn giò sống với mộc nhĩ hành rồi vo viên mọc và luộc chín, Phi hành cho sườn săn rồi cho vào nồi nước dùng thêm mọc và nêm lại","Người bận rộn, Sinh viên, Trẻ em",Người dị ứng hải sản
bun-oc,Bún ốc,Bắc,main,breakfast,20,20,medium,500,20,60,15,3,900,5,35000,65000,balanced,"shellfish,fish_sauce","savory,umami",1,1,https://ducankitchen.com/wp-content/uploads/2021/07/bun-oc-chay-01.jpg,"Bún, ốc với nước dùng có vị chua","Ốc mít: 500g, Thịt ba chỉ: 200g, Nước hầm xương: 1.5 lít, Bún tươi: 500g, Dứa: 1/2 quả, Đậu hũ: 100g, Lá chanh: 5 lá, Sả: 2 nhánh, Hành tím: 3 củ, Tỏi: 5 tép, Hành tây: 1/2 củ, Ớt: 5 trái, Rau thơm: 20g, Ớt sa tế: 3 muỗng canh, Dầu ăn: 3 muỗng canh, Nước mắm: 2.5 muỗng canh","Chảo, Tô, Muỗng, Nồi, Đũa","Luộc ốc với sả lá chanh rồi khêu lấy thịt, Sơ chế sả hành tía tô ngò rí dứa hành tây đậu hũ và thịt ba chỉ, Phi hành tỏi sả rồi nấu nước dùng với nước hầm xương thơm đậu hũ sa tế và gia vị, Xào thịt ba chỉ với ốc và nêm cho thấm, Xếp bún chan nước dùng rồi thêm đậu hũ thịt và ốc xào","Sinh viên, Người lớn tuổi, Trẻ em",Người dị ứng hải sản
bun-rieu-cua,Bún riêu cua,Trung,main,lunch,20,20,medium,420,18,55,10,3,900,4,30000,60000,balanced,fish_sauce,"savory,umami",1,1,https://cdn.tgdd.vn/2020/08/CookProduct/Untitled-1-1200x676-10.jpg,"Bún và riêu cua được nấu từ gạch cua, thân cua giã, lọc với quả dọc, cà chua, mỡ nước, mẻ ngấu, nước mắm, muối, hành hoa.","Cua đồng xay: 1kg, Bún tươi: 400g, Giò sống: 100g, Huyết heo: 200g, Tôm khô: 50g, Mực khô: 30g, Lòng đỏ trứng gà: 2 cái, Mỡ heo: 100g, Đậu hũ: 150g, Cà chua: 500g, Rau ăn kèm: 300g, Hành tím: 100g, Hành lá: 20g, Dầu ăn: 150ml, Dầu điều: 1 muỗng canh, Mắm tôm: 20g, Nước mắm: 20ml","Chén, Thớt, Nồi, Đũa, Dao","Sơ chế cua lấy nước riêu và tách gạch, Chiên mỡ đậu hũ hành lá cà chua huyết tôm khô mực khô, Phi hành tím giòn và xào gạch cua, Làm chả cua rồi hấp chín, Xào cà chua với dầu điều, Nấu nước dùng với tôm mực xác cua rồi thêm nước riêu cua cà chua đậu hũ huyết gạch cua và nêm lại","Sinh viên, Người bận rộn, Người lớn tuổi",Người ăn chay
bun-thit-nuong,Bún thịt nướng,Trung,main,lunch,20,20,medium,500,20,60,15,3,900,5,35000,65000,balanced,fish_sauce,"savory,umami",1,1,https://cdn2.fptshop.com.vn/unsafe/1920x0/filters:format(webp):quality(75)/2023_10_9_638324664353641656_bun-thit-nuong-thumb.jpg,Bún ăn với thịt nướng cùng nước mắm và rau sống kiểu Huế.,"Thịt nạc vai heo: 800g, Hành tím: 30g, Tỏi: 30g, Đậu phộng rang: 100g, Hành lá: 60g, Sả: 3 cây, Ớt sừng: 2 trái, Củ cải trắng: 1 củ, Cà rốt: 1 củ, Sữa tươi không đường: 120ml, Mật ong: 2 muỗng canh, Bún tươi: 1 ít","Chén, Nồi, Nồi hấp, Rây","Sơ chế thịt heo và băm hành tỏi sả ớt rồi chuẩn bị rau củ, Ướp thịt với dầu điều nước mắm nước tương đường gia vị sữa và mật ong, Nướng thịt bằng than hoặc lò hoặc nồi chiên hoặc chảo, Làm đồ chua từ cà rốt củ cải với giấm đường, Pha nước mắm chua ngọt với tỏi ớt, Làm mỡ hành bằng cách đổ dầu nóng vào hành lá","Bữa tiệc, Sinh viên, Gia đình",Người ăn chay
bun-thang,Bún thang,Bắc,main,breakfast,20,20,medium,500,20,60,15,3,900,5,35000,65000,balanced,"shrimp,egg","savory,umami",1,1,https://www.huongnghiepaau.com/wp-content/uploads/2016/04/mon-bun-thang.jpg,"Bún ăn với nước dùng và cần đến 20 nguyên liệu: rau răm, mùi tàu, trứng gà rán mỏng, lườn gà xé, giò lụa thái sợi rải đều trên nền bún trắng. Bún phải là loại bún sợi nhỏ. Trên rắc tôm bông và rải vài lát lạp xường.","Gà ta: 1/2 con, Xương ống: 300g, Sá sùng (hoặc tôm khô): 15g, Chả lụa: 100g, Trứng gà: 1 quả, Ca la thầu: 30g, Hành tây: 1/4 củ, Cà rốt: 1/2 củ, Hành tím: 4 củ, Hành lá/ngò rí: 1 ít, Bún tươi: 600g, Mắm tôm: 50g, Nước mắm: 1/2 muỗng canh, Bột canh: 1 muỗng cà phê, Tiêu hạt: 1 muỗng cà phê","Nồi, Nồi hấp, Chảo, Muỗng","Luộc gà và xương với hành tiêu gia vị rồi xé gà, Sơ chế sá sùng ca la thầu trứng chả lụa và hành ngò, Ninh nước dùng với sá sùng cà rốt hành tây, Chần bún rồi xếp gà chả trứng ca la thầu và chan nước dùng","Gia đình, Trẻ em, Bữa tiệc",Người ăn chay
cao-lau,Cao lầu,Trung,main,lunch,20,20,medium,500,20,60,15,3,900,5,35000,65000,balanced,gluten,"savory,umami",1,1,https://i-giadinh.vnecdn.net/2023/03/13/Buoc-7-Thanh-pham-1-7-9577-1678700377.jpg,Đặc sản của Hội An với sợi mì được chế biến rất công phu ăn cùng giá đỗ và thịt xá xíu,"Thịt heo: 500g, Xương ống heo: 500g, Bột mì đa dụng: 200g, Bột gạo: 200g, Bột năng: 140g, Tỏi: 6 tép, Nước tương: 3 muỗng canh, Ngũ vị hương: 1 muỗng cà phê, Hành tây: 1 củ, Rau thơm ăn kèm: 1 ít, Giá: 1 ít","Đũa, Vá, Chảo, Kéo","Trộn và nhào bột rồi ủ tạo khối bột dẻo, Cán bột cắt sợi rồi hấp chín làm mì cao lầu, Sơ chế xương heo thịt heo rau thơm giá và hành tây, Hầm xương với hành tây làm nước dùng, Ướp thịt heo chiên vàng rồi ninh làm xá xíu, Pha nước dùng từ nước hầm xương và sốt xá xíu","Trẻ em, Bữa tiệc, Người lớn tuổi",Người ăn chay
hu-tieu,Hủ tiếu,Nam,main,dinner,20,20,medium,500,20,60,15,3,900,5,35000,65000,balanced,"fish_sauce,pork","savory,umami",1,1,https://i-giadinh.vnecdn.net/2023/05/15/Bc8Thnhphm18-1684125639-9811-1684125654.jpg,"Bánh hủ tiếu chan nước dùng với thịt băm nhỏ, lòng heo nấu cùng. Sau đó trụng sơ bánh hủ tiếu với nước dùng, rồi cho các nguyên liệu phụ vào như giá đỗ, hẹ, thịt băm cùng lòng lợn vào","Sợi hủ tiếu: 30gr, Xương heo: 500gr, Thịt nạc heo: 300gr, Tôm khô: 20gr, Củ cải trắng: 3 củ, Giá: 30gr, Hành lá: 2 nhánh, Hành phi: 1 ít, Tóp mỡ: 1 ít, Dầu ăn: 1/2 muỗng canh, Bột canh: 1/2 muỗng canh, Đường phèn: 2 muỗng canh","Dao, Vá, Thớt, Tô, Nồi, Kéo","Sơ chế thịt xương da heo rồi chần và luộc da cho sạch, Sơ chế củ cải giá hành, Nấu nước dùng với xương thịt củ cải và tôm khô rồi nêm gia vị, Vớt thịt và da cắt lát, Trụng hủ tiếu và giá rồi xếp tô với thịt da xương bò viên và chan nước dùng","Trẻ em, Người bận rộn, Người lớn tuổi",Người ăn chay
mi-quang,Mì Quảng,Trung,main,breakfast,20,20,medium,500,20,60,15,3,900,5,35000,65000,balanced,"shrimp,gluten","savory,umami",1,1,https://duonggiahotel.vn/wp-content/uploads/2023/09/quan-my-quang-da-nang.jpg,"Được làm từ sợi mì bằng bột gạo xay mịn và tráng thành từng lớp bánh mỏng, sau đó thái theo chiều ngang để có những sợi mì mỏng khoảng 2mm. Sợi mì làm bằng bột mỳ được trộn thêm một số phụ gia cho đạt độ dòn, dai. Dưới lớp mì là các loại rau sống, trên mì là thịt heo nạc, tôm, thịt gà cùng với nước dùng","Mì quảng: 800g, Gà: 1 con, Trứng cút: 15 quả, Nước dừa: 500ml, Đậu phộng rang: 50g, Bánh tráng mè nướng: 4 cái, Bột nghệ: 1 muỗng canh, Dầu màu điều: 1 muỗng canh, Nước dừa tươi: 500ml, Hành lá: 3 nhánh, Hành tây: 1 củ, Củ nén: 10 củ, Rau ăn kèm: 1 ít, Nước mắm: 2 muỗng canh, Đường phèn: 1 muỗng canh, Hạt nêm: 1/2 muỗng canh, Muối: 1 ít","Chảo, Kéo, Muỗng, Rây, Chén","Sơ chế gà rau hành củ nén và đậu phộng, Ướp gà với củ nén hành tây bột nghệ rồi luộc trứng cút, Phi hành củ nén với dầu điều rồi xào gà và nấu nước dùng với nước lọc nước dừa và nêm gia vị thêm trứng cút, Trụng mì rồi xếp gà trứng cút hành đậu phộng và chan nước dùng","Người bận rộn, Sinh viên, Bữa tiệc",Người ăn chay
mi-xao,Mì xào,Trung,main,dinner,20,20,medium,500,20,60,15,3,900,5,35000,65000,balanced,"egg,gluten","savory,umami",1,1,https://cookbeo.com/media/2021/05/mi-xao-hai-san/mi-xao-hai-san-4x3.jpg,"Mì xào chín giòn với trứng, thịt, rau, hải sản...","Mì: 100g, Tôm: 100g, Mực: 200g, Ớt chuông: 1 quả, Cải thìa: 100g, Dầu ăn: 2 muỗng canh, Gia vị thông dụng: 1 ít","Chảo, Kéo, Vá, Nồi hấp, Tô, Dao","Sơ chế tôm mực ớt chuông cải thìa tỏi và ngâm mì, Ướp tôm mực với gia vị, Chần mì sơ rồi xả lạnh, Xào tỏi rồi xào tôm mực tiếp xào ớt chuông cải thìa và trộn mì cho thấm rồi cho hải sản vào xào chung","Bữa tiệc, Người lớn tuổi, Người bận rộn",Người cần hạn chế dầu mỡ
mi-xao-gion,Mì xào giòn,Trung,main,lunch,20,20,medium,500,20,60,15,3,900,5,35000,65000,balanced,"egg,gluten","savory,umami",1,1,https://i.ytimg.com/vi/f--i8wMAZZg/sddefault.jpg,"Mì trứng chiên giòn, phủ hải sản, rau và nước sốt","Mì chiên giòn: 2 gói, Tôm tươi: 200g, Mực tươi: 200g, Bóng bì lợn: 1/2 cái, Nấm đông cô tươi: 100g, Nấm rơm: 100g, Rau cải ngọt: 100g, Cà rốt: 1 củ, Củ sắn: 1/2 củ, Hành tây: 1 củ, Hành lá/cần tây: 1 ít, Tỏi: 4 tép, Hành tím: 2 củ, Rượu trắng: 4 muỗng canh, Bột năng: 1 muỗng canh, Dầu hào: 1 muỗng canh, Dầu ăn: 500ml, Gia vị thông dụng: 1 ít","Tô, Kéo, Chảo, Nồi hấp","Sơ chế rau củ nấm hành tỏi, Sơ chế bóng bì tôm mực, Xào bóng bì rồi xào tôm mực nêm gia vị, Chiên mì cho vàng giòn rồi xào rau củ thêm bóng bì tôm mực và tạo độ sánh","Trẻ em, Sinh viên, Người bận rộn",Người cần hạn chế dầu mỡ
mien-luon,Miến lươn,Trung,main,dinner,20,20,medium,500,20,60,15,3,900,5,35000,65000,balanced,fish_sauce,"savory,umami",1,1,https://i-giadinh.vnecdn.net/2022/11/10/Buoc-6-thanh-pham-6-4302-1668073404.jpg,Được nấu từ miến với thịt lươn có hai dạng: dạng miến lươn khô và miến lươn nước nấu nước dùng là nước xương,"Miến dong: 200g, Lươn: 500g, Xương heo: 500g, Rau cải: 200g, Giá đỗ: 200g, Cà rốt: 2 củ, Nấm hương: 10g, Nấm mèo: 5 cái, Trứng: 1 quả, Rau thơm: 20g, Gia vị nêm nếm cơ bản: 10g","Muỗng, Dao, Vá, Thớt","Chuẩn bị lươn thái sợi và cắt khúc, Chiên lươn phủ bột cho vàng giòn, Xào lươn mềm với hành và nấm hương, Sơ chế miến nấm rau củ và trộn miến với dầu dầu hào và trứng, Xào rau rồi hầm xương làm nước dùng, Xào miến với lươn giòn lươn mềm rau củ và thêm nước xương cho tơi","Sinh viên, Trẻ em, Người lớn tuổi",Người ăn chay
mien-tron,Miến trộn,Trung,main,lunch,20,20,medium,500,20,60,15,3,900,5,35000,65000,balanced,shrimp,"savory,umami",1,1,https://cdn.nhathuoclongchau.com.vn/unsafe/800x0/filters:quality(95)/https://cms-prod.s3-sgn09.fptcloud.com/cach_lam_mien_tron_ce72b07992.jpg,"Miến được xào hoặc chần qua, trộn với tôm hoặc cua, nêm gia vị chua ngọt và cay","Miến khô: 50gr, Thịt bò: 200gr, Cải bó xôi: 50gr, Nấm kim châm: 50gr, Nấm đông cô: 20gr, Cà rốt: 50gr, Hành tây: 50gr, Ớt chuông: 50gr, Trứng gà: 1 quả (chỉ lấy lòng đỏ), Hành tím: 1 củ, Tỏi: 3 tép, Hạt mè trắng rang: 1/2 muỗng canh, Dầu ăn: 2 muỗng canh, Dầu hào: 1/2 muỗng canh, Dầu mè: 2 muỗng canh, Nước tương: 2 muỗng canh","Chảo, Dao, Nồi, Vá, Kéo, Thớt","Sơ chế thịt bò và cắt lát, Ướp thịt bò với hành tỏi dầu hào nước tương dầu mè và tiêu, Sơ chế cải bó xôi ớt chuông hành tây nấm hương cà rốt nấm kim châm, Luộc miến và cải bó xôi rồi trộn dầu mè, Chiên trứng rồi cắt sợi, Xào thịt bò rồi xào rau củ và cho vào tô miến, Trộn miến với nước tương dầu mè đường và tiêu rồi thêm trứng và mè","Người lớn tuổi, Bữa tiệc, Trẻ em",Người ăn chay
