id,name_vi,region,category,meal_types,prep_time_min,cook_time_min,difficulty,calories,protein_g,carbs_g,fat_g,fiber_g,sodium_mg,sugar_g,price_est_vnd_min,price_est_vnd_max,diet_tags,allergens,taste_profile,spice_level,servings,image_url,description,ingredients,utensils,steps,suitable_for,avoid_for
ca-thu-xao-bo-toi-voi-nam-dong-co-kieu-keto,Cá thu xào bơ tỏi với nấm đông cô kiểu keto,Bắc,main,lunch,15,20,medium,453,34,4,43,3,816,3,30000,70000,keto,fish_sauce,"crispy,savory",1,1,https://img-global.cpcdn.com/recipes/fe29b22cbe3806bd/300x426f0.499729_0.5_1.0q80/ca-s%E1%BB%91t-b%C6%A1-t%E1%BB%8Fi-recipe-main-photo.webp,"Cá thu xào bơ tỏi với nấm đông cô kiểu keto là món ăn ít tinh bột, nhiều đạm và chất béo tốt, phù hợp cho chế độ keto kiểu Việt.","Cá thu: 200g, nấm đông cô: 150g, Bơ lạt: 20g, Tỏi băm: 10g, Nước mắm: 10ml, Muối: 3g, Tiêu: 2g, Dầu ôliu: 10ml","Nồi hấp, Rây, Thau, Đũa, Vá","Sơ chế và rửa sạch nguyên liệu, Ướp Cá thu với gia vị cơ bản, Làm nóng chảo và xào/áp chảo cùng nấm đông cô, Nêm lại cho vừa ăn và trình bày ra dĩa","Người tập gym, Người ăn keto","Người ăn chay, Người kiêng chất béo"
ca-hoi-xao-bo-toi-voi-rau-cai-thia-kieu-keto,Cá hồi xào bơ tỏi với rau cải thìa kiểu keto,Nam,main,lunch,10,20,easy,566,28,10,28,7,427,1,25000,45000,keto,fish_sauce,"savory,umami",1,1,https://cakholangvudai.com/wp-content/uploads/2015/01/ca-hoi-xao-cai-thia.jpg,"Cá hồi xào bơ tỏi với rau cải thìa kiểu keto là món ăn ít tinh bột, nhiều đạm và chất béo tốt, phù hợp cho chế độ keto kiểu Việt.","Cá hồi: 200g, rau cải thìa: 150g, Bơ lạt: 20g, Tỏi băm: 10g, Nước mắm: 10ml, Muối: 3g, Tiêu: 2g, Dầu ôliu: 10ml","Nồi, Thớt, Dao, Muỗng, Đũa, Tô","Sơ chế và rửa sạch nguyên liệu, Ướp Cá hồi với gia vị cơ bản, Làm nóng chảo và xào/áp chảo cùng rau cải thìa, Nêm lại cho vừa ăn và trình bày ra dĩa","Người tập gym, Người ăn keto","Người ăn chay, Người kiêng chất béo"
thit-ba-roi-tron-salad-dau-oliu-voi-bi-ngoi-kieu-keto,Thịt ba rọi trộn salad dầu ôliu với bí ngòi kiểu keto,Bắc,main,dinner,10,25,medium,408,33,12,41,3,665,5,30000,70000,keto,pork,"savory,umami",1,1,https://img-global.cpcdn.com/recipes/7f703755d49986f4/680x781cq80/salad-th%E1%BB%8Bt-xong-khoi-recipe-main-photo.jpg,"Thịt ba rọi trộn salad dầu ôliu với bí ngòi kiểu keto là món ăn ít tinh bột, nhiều đạm và chất béo tốt, phù hợp cho chế độ keto kiểu Việt.","Thịt ba rọi: 200g, bí ngòi: 150g, Bơ lạt: 20g, Tỏi băm: 10g, Nước mắm: 10ml, Muối: 3g, Tiêu: 2g, Dầu ôliu: 10ml","Chảo, Nồi, Đũa, Thớt, Dao, Chén","Sơ chế và rửa sạch nguyên liệu, Ướp Thịt ba rọi với gia vị cơ bản, Làm nóng chảo và xào/áp chảo cùng bí ngòi, Nêm lại cho vừa ăn và trình bày ra dĩa","Người giảm cân, Người ăn keto, Người bận rộn","Người ăn chay, Người kiêng chất béo"
ca-thu-xao-bo-toi-voi-mang-tay-kieu-keto,Cá hồi xào bơ tỏi với măng tây kiểu keto,Nam,main,breakfast,10,25,medium,469,30,4,25,5,563,1,35000,75000,keto,fish_sauce,"rich,umami",1,1,https://lisadofoods.com.vn/wp-content/uploads/2020/05/mang-tay-sot-bo-voi-ca-hoi-1-min.png,"Cá thu xào bơ tỏi với măng tây kiểu keto là món ăn ít tinh bột, nhiều đạm và chất béo tốt, phù hợp cho chế độ keto kiểu Việt.","Cá hồi: 200g, măng tây: 150g, Bơ lạt: 20g, Tỏi băm: 10g, Nước mắm: 10ml, Muối: 3g, Tiêu: 2g, Dầu ôliu: 10ml","Nồi, Thớt, Dao, Muỗng, Đũa, Tô","Sơ chế và rửa sạch nguyên liệu, Ướp Cá thu với gia vị cơ bản, Làm nóng chảo và xào/áp chảo cùng măng tây, Nêm lại cho vừa ăn và trình bày ra dĩa","Người giảm cân, Người ăn keto, Người bận rộn","Người ăn chay, Người kiêng chất béo"
trung-ga-xao-toi-voi-bong-cai-xanh-kieu-keto,Trứng gà xào tỏi với bông cải xanh kiểu keto,Bắc,main,dinner,20,25,easy,510,20,5,25,5,337,1,35000,55000,keto,"chicken,egg","garlicky,buttery",0,1,https://img-global.cpcdn.com/recipes/e816eae0e7583edc/680x781f0.5_0.501055_1.0q80/bong-c%E1%BA%A3i-xanh-xao-tr%E1%BB%A9ng-recipe-main-photo.jpg,"Trứng gà xào tỏi với bông cải xanh kiểu keto là món ăn ít tinh bột, nhiều đạm và chất béo tốt, phù hợp cho chế độ keto kiểu Việt.","Trứng gà: 200g, bông cải xanh: 150g, Bơ lạt: 20g, Tỏi băm: 10g, Nước mắm: 10ml, Muối: 3g, Tiêu: 2g, Dầu ôliu: 10ml","Chảo, Nồi, Đũa, Thớt, Dao, Chén","Sơ chế và rửa sạch nguyên liệu, Ướp Trứng gà với gia vị cơ bản, Làm nóng chảo và xào/áp chảo cùng bông cải xanh, Nêm lại cho vừa ăn và trình bày ra dĩa","Người giảm cân, Người ăn keto, Người bận rộn","Người ăn chay, Người kiêng chất béo"
thit-bo-kho-tieu-xanh-voi-bi-ngoi-kieu-keto,Thịt bò kho tiêu xanh với bí ngòi kiểu keto,Nam,main,breakfast,15,20,medium,526,28,4,43,3,401,3,40000,70000,keto,chicken,"garlicky,buttery",0,1,https://pacow.net/upload/tiny/bi-ngoi-xao-bo-3.jpg,"Thịt bò kho tiêu xanh với bí ngòi kiểu keto là món ăn ít tinh bột, nhiều đạm và chất béo tốt, phù hợp cho chế độ keto kiểu Việt.","Thịt bò: 200g, bí ngòi: 150g, Bơ lạt: 20g, Tỏi băm: 10g, Nước mắm: 10ml, Muối: 3g, Tiêu: 2g, Dầu ôliu: 10ml","Chảo chống dính, Thớt, Dao, Muỗng, Dĩa","Sơ chế và rửa sạch nguyên liệu, Ướp Thịt bò với gia vị cơ bản, Làm nóng chảo và xào/áp chảo cùng bí ngòi, Nêm lại cho vừa ăn và trình bày ra dĩa","Người tập gym, Người ăn keto","Người ăn chay, Người kiêng chất béo"
thit-bo-nuong-lo-voi-nam-dong-co-kieu-keto,Thịt bò nướng lò với nấm đông cô kiểu keto,Nam,main,lunch,20,15,medium,444,29,6,43,3,460,4,25000,55000,keto,chicken,"garlicky,buttery",2,1,https://cdn.tgdd.vn/Files/2023/01/05/1500948/cong-thuc-lam-bo-ham-nam-dong-co-boi-bo-ca-nha-cuoi-tuan-202301051242109633.jpg,"Thịt bò nướng lò với nấm đông cô kiểu keto là món ăn ít tinh bột, nhiều đạm và chất béo tốt, phù hợp cho chế độ keto kiểu Việt.","Thịt bò: 200g, nấm đông cô: 150g, Bơ lạt: 20g, Tỏi băm: 10g, Nước mắm: 10ml, Muối: 3g, Tiêu: 2g, Dầu ôliu: 10ml","Chảo chống dính, Thớt, Dao, Muỗng, Dĩa","Sơ chế và rửa sạch nguyên liệu, Ướp Thịt bò với gia vị cơ bản, Làm nóng chảo và xào/áp chảo cùng nấm đông cô, Nêm lại cho vừa ăn và trình bày ra dĩa","Người giảm cân, Người ăn keto, Người bận rộn","Người ăn chay, Người kiêng chất béo"
ca-hoi-xao-bo-toi-salad,Cá hồi áp chảo salad,Bắc,main,breakfast,20,15,medium,468,28,9,33,5,634,5,25000,55000,keto,fish_sauce,"rich,umami",2,1,https://img-global.cpcdn.com/recipes/cb6b96abdb71195f/300x426cq80/ca-h%E1%BB%93i-ap-ch%E1%BA%A3o-salad-keto-recipe-main-photo.webp,"Cá hồi áp chảo salad là món ăn thanh đạm, ít tinh bột, giàu protein và bổ sung nhiều chất béo tốt từ cá hồi. Kết hợp cùng salad rau xanh kiểu Việt, món ăn mang lại cảm giác tươi mát nhưng vẫn đảm bảo phù hợp với chế độ ăn Eat Clean hoặc Keto theo phong cách Việt Nam.","Cá hồi sống: 120g, Rau bina: 40g, 1/2 quả bơ (avocado): 70g, Cà chua bi: 60g, Phô mai: 20g, Nước cốt chanh: 5ml, Bơ: 10g, Muối: 2g, Hạt tiêu: 1g, Đường ăn kiêng: 2g","Nồi hấp, Rây, Thau, Đũa, Vá","Sơ chế và rửa sạch rau bina, cà chua bi và bơ, Cắt cá hồi thành lát vừa ăn, Trộn cá hồi với nước cốt chanh, muối, tiêu cho thấm nhẹ, Làm chảy bơ rồi rưới lên phần salad, Thêm phô mai và đường ăn kiêng, Trộn đều tất cả nguyên liệu và trình bày ra dĩa","Gia đình, Người ăn lowcarb","Người ăn chay, Người kiêng chất béo"
uc-ga-nuong-lo-voi-rau-muong-kieu-keto,Salad ức gà,Bắc,main,breakfast,20,20,easy,405,31,5,42,3,407,3,35000,55000,keto,chicken,"savory,umami",1,1,https://img-global.cpcdn.com/recipes/15e5cd416f2632b0/300x426f0.5_0.518829_1.0q80/salad-%E1%BB%A9c-ga-keto-recipe-main-photo.webp,"Salad ức gà là món ăn ít tinh bột, giàu đạm và nhiều chất xơ từ rau xanh, giúp no lâu nhưng vẫn giữ cảm giác nhẹ bụng. Món này phù hợp cho chế độ ăn Eat Clean hoặc Keto kiểu Việt, mang đến sự thanh mát mà vẫn đảm bảo đầy đủ dinh dưỡng cho một bữa ăn lành mạnh.","Ức gà: 150g, Xúc xích: 50g, Rau mầm: 50g, Xà lách: 4 lá, Dưa leo baby: 3 trái, Cà chua bi: 5 quả, Nước sốt mè rang: 20ml","Nồi hấp, Rây, Thau, Đũa, Vá","Sơ chế và rửa sạch nguyên liệu, Ướp ức gà với gia vị cơ bản, Làm nóng chảo và áp chảo ức gà đến khi chín vàng, Trộn rau mầm, xà lách, dưa leo baby và cà chua bi với sốt mè rang, Cắt ức gà đặt lên salad, Nêm lại cho vừa ăn và trình bày ra dĩa","Gia đình, Người ăn lowcarb","Người ăn chay, Người kiêng chất béo"
thit-bo-rim-nuoc-mam-voi-cai-xanh-kieu-keto,Thịt bò rim nước mắm với cải xanh kiểu keto,Bắc,main,lunch,10,20,medium,639,22,7,31,7,339,3,35000,55000,keto,chicken,"savory,umami",1,1,https://img-global.cpcdn.com/recipes/880bfc1e5a8260a3/680x781cq80/c%E1%BA%A3i-r%E1%BB%95-xao-th%E1%BB%8Bt-bo-recipe-main-photo.jpg,"Thịt bò rim nước mắm với cải xanh kiểu keto là món ăn ít tinh bột, nhiều đạm và chất béo tốt, phù hợp cho chế độ keto kiểu Việt.","Thịt bò: 200g, cải xanh: 150g, Bơ lạt: 20g, Tỏi băm: 10g, Nước mắm: 10ml, Muối: 3g, Tiêu: 2g, Dầu ôliu: 10ml","Chảo, Nồi, Đũa, Thớt, Dao, Chén","Sơ chế và rửa sạch nguyên liệu, Ướp Thịt bò với gia vị cơ bản, Làm nóng chảo và xào/áp chảo cùng cải xanh, Nêm lại cho vừa ăn và trình bày ra dĩa","Gia đình, Người ăn lowcarb","Người ăn chay, Người kiêng chất béo"
tom-nuong-lo-voi-rau-cai-thia-kieu-keto,Tôm nướng lò với rau cải thìa kiểu keto,Bắc,main,dinner,20,20,medium,548,33,4,43,5,685,4,25000,45000,keto,shrimp,"garlicky,buttery",1,1,https://img-global.cpcdn.com/recipes/012bb55ab28f80b2/680x781cq80/tom-xao-c%E1%BA%A3i-thia-recipe-main-photo.jpg,"Tôm nướng lò với rau cải thìa kiểu keto là món ăn ít tinh bột, nhiều đạm và chất béo tốt, phù hợp cho chế độ keto kiểu Việt.","Tôm: 200g, rau cải thìa: 150g, Bơ lạt: 20g, Tỏi băm: 10g, Nước mắm: 10ml, Muối: 3g, Tiêu: 2g, Dầu ôliu: 10ml","Chảo chống dính, Thớt, Dao, Muỗng, Dĩa","Sơ chế và rửa sạch nguyên liệu, Ướp Tôm với gia vị cơ bản, Làm nóng chảo và xào/áp chảo cùng rau cải thìa, Nêm lại cho vừa ăn và trình bày ra dĩa","Người giảm cân, Người ăn keto, Người bận rộn","Người ăn chay, Người kiêng chất béo"
ca-thu-kho-tieu-xanh-voi-rau-muong-kieu-keto,Cá thu kho tiêu xanh  kiểu keto,Nam,main,breakfast,15,20,medium,485,23,7,40,5,465,4,35000,55000,keto,fish_sauce,"garlicky,buttery",0,1,https://img-global.cpcdn.com/recipes/f620f0bc1fdf79fd/300x426cq80/ca-thu-kho-tieu-xanh-recipe-main-photo.webp,"Cá thu kho tiêu xanh kiểu keto là món ăn ít tinh bột, giàu đạm và chất béo tốt từ cá thu. Vị cay thơm của tiêu xanh hòa cùng nước kho đậm đà tạo nên món ăn đậm chất Việt Nam nhưng vẫn phù hợp cho chế độ ăn Keto.","Cá thu: 200g, Tiêu xanh: 10g, Nước mắm: 15ml, Dầu ôliu hoặc dầu dừa: 10ml, Tỏi băm: 5g, Hành tím: 5g, Nước lọc: 30ml, Muối: 1g, Tiêu xay: 1g, Đường ăn kiêng: 2g","Chảo chống dính, Thớt, Dao, Muỗng, Dĩa","Sơ chế và rửa sạch cá thu, Phi thơm tỏi và hành tím với dầu, Cho cá thu vào áp chảo nhẹ cho săn, Thêm nước mắm, tiêu xanh, nước lọc và đường ăn kiêng, Kho lửa nhỏ đến khi nước sệt lại, Nêm lại cho vừa ăn và trình bày ra dĩa","Người giảm cân, Người ăn keto, Người bận rộn","Người ăn chay, Người kiêng chất béo"
uc-ga-nuong-lo-voi-nam-dong-co-kieu-keto,Ức gà nướng lò với nấm đông cô kiểu keto,Bắc,main,lunch,10,15,medium,621,26,5,32,5,470,4,30000,60000,keto,chicken,"rich,umami",2,1,https://img-global.cpcdn.com/recipes/64cdadfb275d9bb1/200x200f0.638018_0.5_1.0q80/%E1%BB%A9c-ga-kho-h%E1%BA%A1t-di%E1%BB%81u-n%E1%BA%A5m-dong-co-recipe-main-photo.jpg,"Ức gà nướng lò với nấm đông cô kiểu keto là món ăn ít tinh bột, giàu đạm và chất béo tốt. Thịt gà mềm, thơm, kết hợp vị ngọt tự nhiên từ nấm đông cô mang lại bữa ăn chuẩn keto nhưng vẫn đậm chất Việt Nam.","Ức gà: 200g, Nấm đông cô tươi: 150g, Bơ lạt: 15g, Tỏi băm: 5g, Dầu ôliu: 10ml, Muối: 2g, Tiêu: 1g, Lá oregano hoặc hương thảo: 1g, Đường ăn kiêng: 1g","Nồi, Thớt, Dao, Muỗng, Đũa, Tô","Sơ chế và rửa sạch ức gà và nấm đông cô, Ướp ức gà với muối tiêu tỏi dầu ôliu và gia vị, Làm nóng lò và trải nấm đông cô dưới khay nướng, Đặt ức gà lên và phết bơ lạt, Nướng đến khi gà chín vàng và nấm mềm ngọt, Nêm lại cho vừa ăn và trình bày ra dĩa","Người tập gym, Người ăn keto","Người ăn chay, Người kiêng chất béo"
uc-ga-nuong-lo-voi-rau-cai-thia-kieu-keto,Ức gà áp chảo với rau cải thìa kiểu keto,Trung,main,dinner,10,25,medium,472,26,11,27,3,345,4,40000,70000,keto,chicken,"savory,umami",1,1,https://img-global.cpcdn.com/recipes/bdc90bc86937dc9f/680x781f0.5_0.508259_1.0q80/%E1%BB%A9c-ga-ap-ch%E1%BA%A3o-c%E1%BA%A3i-thia-lu%E1%BB%99c-recipe-main-photo.jpg,"Ức gà áp chảo với rau cải thìa kiểu keto là món ăn ít tinh bột, giàu đạm và cung cấp nhiều vitamin từ rau xanh. Ức gà được áp chảo săn vàng, kết hợp cải thìa giòn ngọt, mang đến bữa ăn đơn giản, nhanh gọn nhưng vẫn chuẩn keto kiểu Việt.","Ức gà: 200g, Cải thìa: 150g, Bơ lạt: 10g, Tỏi băm: 5g, Dầu ôliu: 10ml, Nước mắm: 10ml, Muối: 2g, Tiêu: 1g, Đường ăn kiêng: 1g","Nồi hấp, Rây, Thau, Đũa, Vá","Sơ chế và rửa sạch ức gà và cải thìa, Ướp ức gà với muối tiêu và tỏi, Làm nóng chảo với dầu ôliu và áp chảo ức gà đến khi vàng đều, Xào cải thìa với bơ lạt và nước mắm cho thấm vị, Thêm đường ăn kiêng nếu muốn vị dịu, Trình bày ức gà cùng cải thìa ra dĩa và nêm lại cho vừa ăn","Người tập gym, Người ăn keto","Người ăn chay, Người kiêng chất béo"
thit-bo-xao-toi-voi-bi-ngoi-kieu-keto,Thịt bò xào tỏi với bí ngòi kiểu keto,Nam,main,breakfast,10,25,easy,483,32,9,31,4,477,5,30000,50000,keto,chicken,"savory,umami",0,1,https://cdn.tgdd.vn/2020/07/CookRecipe/Avatar/bi-ngoi-xao-thit-bo-thumbnail.jpg,"Thịt bò xào tỏi với bí ngòi kiểu keto là món ăn ít tinh bột, giàu đạm và chất béo tốt. Thịt bò mềm thơm kết hợp bí ngòi giòn ngọt, tạo nên bữa ăn nhanh gọn nhưng vẫn chuẩn keto kiểu Việt, phù hợp cho người ăn kiêng hoặc kiểm soát carb.","Thịt bò: 200g, Bí ngòi xanh: 150g, Tỏi băm: 8g, Dầu ôliu: 10ml, Muối: 2g, Tiêu: 1g, Nước mắm: 10ml, Bơ lạt: 10g, Đường ăn kiêng: 1g","Nồi, Thớt, Dao, Muỗng, Đũa, Tô","Sơ chế và rửa sạch thịt bò và bí ngòi, Ướp thịt bò với muối tiêu và tỏi, Làm nóng chảo với dầu ôliu rồi xào bò cho săn, Thêm bí ngòi và đảo đều đến khi chín vừa, Cho bơ lạt và nước mắm vào tạo độ bóng và đậm vị, Nêm lại với đường ăn kiêng và trình bày ra dĩa","Người tập gym, Người ăn keto","Người ăn chay, Người kiêng chất béo"
trung-ga-tron-salad-dau-oliu-voi-rau-cai-thia-kieu-keto,Trứng gà trộn salad dầu ôliu kiểu keto,Bắc,main,lunch,10,20,medium,492,31,9,44,6,809,4,35000,65000,keto,"chicken,egg","rich,umami",1,1,https://img-global.cpcdn.com/recipes/7c02e0aa72b26c3d/240x320cq80/photo.jpg,"Trứng gà trộn salad dầu ôliu kiểu keto là món ăn nhẹ, ít tinh bột nhưng giàu đạm và chất béo tốt. Sự kết hợp giữa trứng luộc béo bùi và salad tươi mát, thêm dầu ôliu thơm ngậy tạo nên bữa ăn nhanh gọn, lành mạnh và phù hợp cho chế độ keto kiểu Việt.","Trứng gà: 2 quả , Xà lách: 40g, Rau mầm: 30g, Dưa leo: 50g, Cà chua bi: 50g, Dầu ôliu: 10ml, Muối: 1g, Tiêu: 1g, Giấm táo hoặc chanh: 5ml","Nồi hấp, Rây, Thau, Đũa, Vá","Luộc trứng và bóc vỏ, Sơ chế và rửa sạch xà lách rau mầm dưa leo và cà chua bi, Cắt nhỏ trứng và rau củ, Trộn với dầu ôliu muối tiêu và giấm táo, Điều chỉnh gia vị cho vừa ăn và trình bày ra dĩa","Gia đình, Người ăn lowcarb","Người ăn chay, Người kiêng chất béo"
thit-bo-ap-chao-bo-toi-voi-bong-cai-xanh-kieu-keto,Thịt bò xào với bông cải xanh kiểu keto,Trung,main,lunch,15,15,easy,472,24,12,32,5,489,2,25000,65000,keto,chicken,"rich,umami",1,1,https://i.ytimg.com/vi/srAB7chNNi4/hq720.jpg?sqp=-oaymwEhCK4FEIIDSFryq4qpAxMIARUAAAAAGAElAADIQj0AgKJD&rs=AOn4CLCa9gKJdZtJ5lYU3pJf55DKRXrlUw,"Thịt bò xào với bông cải xanh kiểu keto là món ăn ít tinh bột, giàu đạm và vitamin. Thịt bò mềm ngọt kết hợp bông cải xanh giòn nhẹ, tạo nên bữa ăn đơn giản nhưng bổ dưỡng, phù hợp cho chế độ ăn keto kiểu Việt và những ai muốn kiểm soát lượng carb hằng ngày.","Thịt bò: 200g, Bông cải xanh: 150g, Tỏi băm: 8g, Dầu ôliu: 10ml, Bơ lạt: 10g, Nước mắm: 10ml, Muối: 2g, Tiêu: 1g, Đường ăn kiêng: 1g","Nồi hấp, Rây, Thau, Đũa, Vá","Sơ chế và rửa sạch thịt bò và bông cải xanh, Ướp thịt bò với muối tiêu và tỏi, Làm nóng chảo với dầu ôliu rồi xào thịt bò cho săn lại, Cho bông cải xanh vào đảo đều đến khi chín vừa, Thêm bơ lạt nước mắm và đường ăn kiêng để tạo vị đậm đà, Nêm lại cho vừa ăn và trình bày ra dĩa","Người tập gym, Người ăn keto","Người ăn chay, Người kiêng chất béo"
nam-dong-co-xao-cai-thia,Nấm đông cô xào bông cải xanh,Nam,main,lunch,20,25,easy,635,26,7,43,7,673,2,40000,70000,keto,"chicken,egg","crispy,savory",0,1,https://www.lemon8-app.com/seo/image?item_id=7225532812709954050&index=2&sign=c30432abb27680e539bb7ed9a7edccca,"Nấm đông cô xào bông cải xanh là món chay nhẹ nhàng, ít tinh bột, giàu chất xơ và vitamin. Vị ngọt thanh của nấm kết hợp độ giòn của bông cải xanh tạo nên món ăn đơn giản nhưng dinh dưỡng, phù hợp cho chế độ ăn keto hoặc eatclean kiểu Việt.","Nấm đông cô tươi: 150g, Bông cải xanh: 150g, Tỏi băm: 5g,  dầu dừa: 10ml, Muối: 2g, Tiêu: 1g, Nước mắm hoặc xì dầu ít carb: 10ml, Đường ăn kiêng: 1g","Chảo chống dính, Thớt, Dao, Muỗng, Dĩa","Sơ chế và rửa sạch nguyên liệu, Ướp Trứng gà với gia vị cơ bản, Làm nóng chảo và xào/áp chảo cùng nấm đông cô, Nêm lại cho vừa ăn và trình bày ra dĩa","Gia đình, Người ăn lowcarb","Người ăn chay, Người kiêng chất béo"
ca-thu-ap-chao-bo-toi-voi-bong-cai-xanh-kieu-keto,Cá thu áp chảo bơ tỏi với bí ngòi kiểu keto,Bắc,main,lunch,20,15,medium,633,25,12,37,5,394,5,25000,65000,keto,fish_sauce,"crispy,savory",2,1,https://img-global.cpcdn.com/recipes/d931864ab7eea2a7/680x781f0.5_0.514194_1.0q80/ca-thu-ap-ch%E1%BA%A3o-va-bi-ngoi-xao-b%C6%A1-t%E1%BB%8Fi-recipe-main-photo.jpg,"Cá thu áp chảo bơ tỏi với bí ngòi kiểu keto là món ăn ít tinh bột, giàu đạm và chất béo tốt. Cá thu thơm béo, áp chảo vàng giòn kết hợp bí ngòi giòn ngọt tạo nên bữa ăn nhẹ, đậm vị và rất phù hợp cho chế độ keto kiểu Việt.","Cá thu: 200g, Bí ngòi xanh: 150g, Bơ lạt: 12g, Tỏi băm: 5g, Dầu ôliu: 5ml, Muối: 2g, Tiêu: 1g, Nước mắm: 8ml, Đường ăn kiêng: 1g","Nồi hấp, Rây, Thau, Đũa, Vá","Sơ chế và rửa sạch cá thu và bí ngòi, Làm nóng chảo với dầu rồi áp chảo cá thu đến khi vàng đều hai mặt, Phi thơm tỏi với bơ và cho bí ngòi vào xào nhẹ, Nêm muối tiêu nước mắm và đường ăn kiêng, Cho cá thu vào chảo đảo đều cho thấm vị, Trình bày ra dĩa và thưởng thức","Người giảm cân, Người ăn keto, Người bận rộn","Người ăn chay, Người kiêng chất béo"
uc-ga-nam-dui-ga,Ức gà nướng với nấm đùi gà kiểu keto,Nam,main,lunch,15,15,easy,650,24,3,45,5,614,4,35000,65000,keto,chicken,"garlicky,buttery",2,1,https://img-global.cpcdn.com/recipes/231958d2a88272e2/300x426cq80/%E1%BB%A9c-ga-va-n%E1%BA%A5m-dui-ga-n%C6%B0%E1%BB%9Bng-recipe-main-photo.webp,"Ức gà nướng với nấm đùi gà kiểu keto là món ăn ít tinh bột, giàu đạm và chất béo tốt. Thịt gà nướng thơm mềm kết hợp nấm đùi gà ngọt tự nhiên tạo nên bữa ăn đơn giản, nhẹ bụng nhưng vẫn đảm bảo chuẩn keto kiểu Việt.","Ức gà: 200g, Nấm đùi gà: 150g, Bơ lạt: 12g, Dầu ôliu: 10ml, Tỏi băm: 5g, Muối: 2g, Tiêu: 1g, Lá oregano hoặc hương thảo: 1g, Đường ăn kiêng: 1g","Chảo, Nồi, Đũa, Thớt, Dao, Chén","Sơ chế và rửa sạch ức gà và nấm đùi gà, Ướp ức gà với muối tiêu tỏi dầu ôliu và gia vị, Trộn nấm đùi gà với bơ lạt và ít muối, Làm nóng lò và xếp gà cùng nấm vào khay, Nướng đến khi gà chín vàng và nấm mềm ngọt, Nêm lại cho vừa ăn và trình bày ra dĩa","Người tập gym, Người ăn keto","Người ăn chay, Người kiêng chất béo"
canh-rau-cai-ca-thu,Canh rau cỏi non nấu cá thu,Trung,soup,lunch,20,20,easy,411,25,8,42,3,415,3,40000,60000,keto,fish_sauce,"garlicky,buttery",0,1,https://img-global.cpcdn.com/recipes/cf47e46d9628658b/300x426cq80/canh-rau-c%E1%BA%A3i-non-n%E1%BA%A5u-ca-thu-recipe-main-photo.webp,"Canh rau cải non nấu cá thu là món ăn thanh nhẹ, ít tinh bột, giàu đạm và omega-3 tự nhiên từ cá thu. Nước canh ngọt dịu hòa cùng vị tươi của rau cải non tạo nên món ăn nhẹ bụng, phù hợp cho thực đơn lành mạnh hoặc keto kiểu Việt.","Cá thu: 200g, Rau cải non: 150g, Hành tím: 5g, Gừng lát: 5g, Nước mắm: 10ml, Muối: 1g, Tiêu: 1g, Nước lọc: 600ml","Chảo, Nồi, Đũa, Thớt, Dao, Chén","Sơ chế cá thu và rau cải non, Phi thơm hành tím với ít dầu rồi cho cá thu vào xào sơ, Thêm nước lọc gừng lát và nấu sôi, Cho rau cải non vào và nêm nước mắm muối tiêu, Nấu đến khi cải chín vừa và trình bày ra tô","Người giảm cân, Người ăn keto, Người bận rộn","Người ăn chay, Người kiêng chất béo"
ca-hoi-xao-bo-toi-voi-rau-muong-kieu-keto,Cá hồi chiên bơ tỏi ,Nam,main,dinner,15,25,medium,606,32,6,28,4,306,3,40000,80000,keto,fish_sauce,"savory,umami",1,1,https://cdn.tgdd.vn/2020/08/CookProduct/Untitled-1-1200x676-43.jpg,"Cá hồi chiên bơ tỏi là món ăn giàu đạm và chất béo omega-3 tốt cho sức khỏe. Cá hồi được chiên giòn nhẹ bên ngoài, mềm béo bên trong, hòa quyện cùng hương bơ tỏi thơm nồng, tạo nên món ăn đơn giản nhưng rất giàu dinh dưỡng và phù hợp với chế độ ăn keto kiểu Việt.","Cá hồi: 200g, Bơ lạt: 15g, Tỏi băm: 5g, Dầu ôliu: 5ml, Muối: 2g, Tiêu: 1g, Nước mắm: 5ml, Chanh: 1 lát, Đường ăn kiêng: 1g","Chảo, Nồi, Đũa, Thớt, Dao, Chén","Sơ chế và thấm khô cá hồi, Ướp cá hồi với muối tiêu và nước mắm, Làm nóng chảo với dầu rồi chiên cá hồi vàng đều hai mặt, Thêm bơ và tỏi vào chảo đảo cho dậy mùi, Rưới nước bơ tỏi lên cá và thêm lát chanh, Nêm lại nhẹ nếu cần và trình bày ra dĩa","Người giảm cân, Người ăn keto, Người bận rộn","Người ăn chay, Người kiêng chất béo"
